<!ELEMENT timeTable (complexes, lessons)>

<!ELEMENT complexes (complex+)>
<!ELEMENT complex (name, address)>
<!ATTLIST complex
          code ID #REQUIRED>

<!ELEMENT name (#PCDATA)>
<!ELEMENT address (#PCDATA)>

<!ELEMENT lessons (lesson+)>
<!ELEMENT lesson (date, time)>
<!ATTLIST lesson
          no      CDATA #REQUIRED
          complex IDREF #REQUIRED>

<!ELEMENT date (#PCDATA)>
<!ELEMENT time (#PCDATA)>
